Meetup Name,Location,Link,Members
Alamo City Python Group,"San Antonio, TX",https://www.meetup.com/Alamo-City-Python-Group/,1335
Alamo Code Learners,"San Antonio, TX",https://www.meetup.com/Alamo-Code-Learners/,1760
San Antonio Women in Machine Learning & Data Science,"San Antonio, TX",https://www.meetup.com/San-Antonio-Women-in-Machine-Learning-and-Data-Science/,167
San Antonio Data Science,"San Antonio, TX",https://www.meetup.com/San-Antonio-Data-Science/,728
"SA Business Intelligence, Analytics & Data","San Antonio, TX",https://www.meetup.com/bianalytics/,503
San Antonio Artificial Intelligence Events,"San Antonio, TX",https://www.meetup.com/San-Antonio-Artificial-Intelligence-Events/,564
